(base) 6A:5B:0E:48:54:87:~ hoomanafsharnia$ sudo tcpdump -A -i en0
tcpdump: verbose output suppressed, use -v[v]... for full protocol decode
listening on en0, link-type EN10MB (Ethernet), snapshot length 262144 bytes
00:20:32.978674 ARP, Request who-has 192.168.2.16 tell 0b251e9936aaaec6d9d7a744eaba2de, length 46
..........8Tq....
............................
00:20:33.048945 IP 6a:5b:0e:48:54:87.53062 > mynetwork.home.domain: 23756+ PTR? 16.2.168.192.in-addr.arpa. (43)
E..G.$..@.6..........F.5.3..\............16.2.168.192.in-addr.arpa.....
00:20:33.060953 IP mynetwork.home.domain > 6a:5b:0e:48:54:87.53062: 23756 NXDomain* 0/0/0 (43)
E..G}.@.@.7F.........5.F.3E \............16.2.168.192.in-addr.arpa.....
00:20:33.062980 IP 6a:5b:0e:48:54:87.61861 > mynetwork.home.domain: 1740+ PTR? 10.2.168.192.in-addr.arpa. (43)
E..G....@.r............5.3.E.............10.2.168.192.in-addr.arpa.....
00:20:33.066493 IP mynetwork.home.domain > 6a:5b:0e:48:54:87.61861: 1740* 1/0/0 PTR 0b251e9936aaaec6d9d7a744eaba2de. (88)
E..t}.@.@.7..........5...``..............10.2.168.192.in-addr.arpa................!.0b251e9936aaaec6d9d7a744eaba2de.
00:20:33.170924 IP 6a:5b:0e:48:54:87.57926 > mynetwork.home.domain: 15237+ PTR? 142.2.168.192.in-addr.arpa. (44)
E..H....@.,..........F.5.4..;............142.2.168.192.in-addr.arpa.....
00:20:33.174605 IP mynetwork.home.domain > 6a:5b:0e:48:54:87.57926: 15237* 1/0/0 PTR 6A:5B:0E:48:54:87. (75)
E..g}.@.@.6..........5.F.Sr.;............142.2.168.192.in-addr.arpa..................6A:5B:0E:48:54:87.
00:20:33.175902 IP 6a:5b:0e:48:54:87.58572 > mynetwork.home.domain: 27373+ PTR? 1.2.168.192.in-addr.arpa. (42)
E..F....@.[............5.2.>j............1.2.168.192.in-addr.arpa.....
00:20:33.179557 IP mynetwork.home.domain > 6a:5b:0e:48:54:87.58572: 27373* 1/0/0 PTR mynetwork.home. (70)
E..b}.@.@.6..........5...N.Zj............1.2.168.192.in-addr.arpa.................	mynetwork.home.
00:20:33.849823 IP 6a:5b:0e:48:54:87.58521 > a172-224-186-196.source.akaquill.net.https: UDP, length 41
E..E..@.@................1d.q..dx.f8	........$..h..U........X.+D..Z.(
00:20:33.860431 IP a172-224-186-196.source.akaquill.net.https > 6a:5b:0e:48:54:87.58521: UDP, length 33
E..=..@.5................).oF&.r[...^XcM....(>.r...5
..o.....
00:20:33.997903 ARP, Request who-has 192.168.2.16 tell 0b251e9936aaaec6d9d7a744eaba2de, length 46
..........8Tq....
............................
00:20:34.231089 IP 6a:5b:0e:48:54:87.49289 > bedroom.afs3-fileserver: Flags [P.], seq 3842465424:3842465511, ack 2561015212, win 2048, options [nop,nop,TS val 3480966816 ecr 3570391051], length 87
E.....@.@..............X..^.........U......
.{V.....E..;..'.dL.Y|.+.\..;.I..tk.K....&.....hd.. k..sUn$..1.Ygk
.$.........(e.........r.....B
00:20:34.298033 IP 6a:5b:0e:48:54:87.64332 > mynetwork.home.domain: 21724+ PTR? 14.2.168.192.in-addr.arpa. (43)
E..GQ...@............L.5.3..T............14.2.168.192.in-addr.arpa.....
00:20:34.301539 IP mynetwork.home.domain > 6a:5b:0e:48:54:87.64332: 21724* 1/0/0 PTR Bedroom. (64)
E..\~.@.@.6+.........5.L.H|.T............14.2.168.192.in-addr.arpa................	.Bedroom.
00:20:34.413657 IP bedroom.afs3-fileserver > 6a:5b:0e:48:54:87.49289: Flags [.], ack 87, win 4093, options [nop,nop,TS val 3570393188 ecr 3480966816], length 0
E..4..@.@............X........^.....O_.....
...d.{V.
00:20:34.414948 IP bedroom.afs3-fileserver > 6a:5b:0e:48:54:87.49289: Flags [P.], seq 1:310, ack 87, win 4096, options [nop,nop,TS val 3570393190 ecr 3480966816], length 309
E..i..@.@............X........^...../X.....
...f.{V.#.}....6.OZxj.R/.....|..f.I.....e.....I.$E...~.......I(.4.	=....S..dp.".g..e....D."....?.9w..x.A..d....G...	P...'...(,.+Ta.M.<.......D~G..La&.KA..I.f..f.N.J1...w...7N......r}=.).:!.....
.Yh.'..[...uq..x.....}"....Re...,...H..".>...w*...@...=..<S.tU].$..k.2.hbGr.k..MP.8.02...(.C..7...!K...R...5T..W.rN...i.?..
00:20:34.415094 IP 6a:5b:0e:48:54:87.49289 > bedroom.afs3-fileserver: Flags [.], ack 310, win 2043, options [nop,nop,TS val 3480967000 ecr 3570393190], length 0
E..4..@.@..............X..^.........Ur.....
.{WX...f
00:20:34.509918 IP wlan0.56246 > broadcasthost.6667: UDP, length 172
E....3.....<..............Z...U...................?.Ki._...;.5)R..Q.Rn...
.....yV<VU...9....c...g...V..%<.r.d..)...Y.._.]K.i......R.H.^v......Z.<.....7~Z.> .O6Jy..t..2fBlS...J.n...@.;.?.J%p..y!M.....U
00:20:34.532817 IP 6a:5b:0e:48:54:87.58521 > a172-224-186-196.source.akaquill.net.https: UDP, length 29
E..9..@.@................%..c...K..1?......F.3......K....
00:20:34.546454 IP a172-224-186-196.source.akaquill.net.https > 6a:5b:0e:48:54:87.58521: UDP, length 39
E..C..@.2.{............../b\I....4H,z.`cR.....a$!.#sb5.{/.(\...].RQ
00:20:34.573728 IP 6a:5b:0e:48:54:87.58521 > a172-224-186-196.source.akaquill.net.https: UDP, length 34
E..>..@.@................*./g...K..1?v...B...$D.{K....f...#...
00:20:34.607722 IP 6a:5b:0e:48:54:87.51693 > mynetwork.home.domain: 53490+ PTR? 13.2.168.192.in-addr.arpa. (43)
E..G'...@..............5.3]..............13.2.168.192.in-addr.arpa.....
00:20:34.612767 IP mynetwork.home.domain > 6a:5b:0e:48:54:87.51693: 53490* 1/0/0 PTR wlan0. (62)
E..Z.q@.@.5B.........5...F...............13.2.168.192.in-addr.arpa..................wlan0.
00:20:34.614411 IP 6a:5b:0e:48:54:87.55055 > mynetwork.home.domain: 45691+ PTR? 255.255.255.255.in-addr.arpa. (46)
E..J.1..@.!............5.6...{...........255.255.255.255.in-addr.arpa.....
00:20:34.618543 IP mynetwork.home.domain > 6a:5b:0e:48:54:87.55055: 45691 NXDomain* 0/0/0 (46)
E..J.u@.@.5N.........5...6ut.{...........255.255.255.255.in-addr.arpa.....
00:20:35.025437 ARP, Request who-has 192.168.2.16 tell 0b251e9936aaaec6d9d7a744eaba2de, length 46
..........8Tq....
............................
00:20:35.229732 IP 9e:11:ed:85:e3:86.mdns > mdns.mcast.net.mdns: 0 [2a] [2q] PTR (QM)? _rdlink._tcp.local. PTR (QM)? _companion-link._tcp.local. (117)
E..........>.............}..............._rdlink._tcp.local......_companion-link.......$.........
.Bedroom.$.$...........hooman...s MacBook Air.$
^C00:20:35.229738 IP6 fe80::140d:4ed9:f9a:69cd.mdns > ff02::fb.mdns: 0 [2a] [2q] PTR (QM)? _rdlink._tcp.local. PTR (QM)? _companion-link._tcp.local. (117)
`....}............N...i......................}aa............._rdlink._tcp.local......_companion-link.......$.........
.Bedroom.$.$...........hooman...s MacBook Air.$

29 packets captured
75 packets received by filter
0 packets dropped by kernel
